{
  "authority": {
    "additive_only": true,
    "changes_prior_phase_artifacts": false,
    "holdout_opening_belongs_to": "S4.8",
    "implements_holdout_opening_workflow": false,
    "interlock_artifact_schema": "ias.s4_7.holdout_acceptance.v1",
    "interlock_consumer": "isaac_audio_sensors.acquisition.s4_4.consume_s4_8_grant",
    "opens_holdout_observations": false
  },
  "baseline_branch": "main",
  "baseline_commit": "08c8009814dd2bc2cc1dc4d2d49ddebc96852371",
  "criteria": [
    {
      "comparator": "less_than_or_equal",
      "criterion_id": "bearing_median_absolute_error_stratum_a",
      "decision_rationale": "the adjusted Fit-B development median was 3.79 deg and the weaker Fit-A median was 5.5 deg; 15 deg keeps a bearing usable for SquadBot orientation and Alex sector turning while leaving margin for an unseen session",
      "denominator": {
        "basis": "takes",
        "expected_count": 24
      },
      "failure_logic": "a violated readiness criterion keeps S4.8 and S4 failed for the claimed envelope and may not be relaxed, rescoped, or removed",
      "gating": true,
      "metric": "bearing_doa_error",
      "metric_contract": {
        "aggregation": "per-take median, then the named statistic across takes",
        "applicability": "bearing-referenced controlled takes inside the frozen envelope",
        "exclusions": "abstained windows are excluded from the numeric error and counted separately by the abstention criteria; no take is excluded",
        "limitations": "functional bearing accuracy of the exact tested rig, room, source, and analysis path; not a calibrated or transferable angular accuracy",
        "method": "SRP-PHAT primary estimator on frozen raw-channel analysis windows, reduced to one median absolute bearing error per take",
        "missing": "a take with no valid bearing window is a criterion failure, never a silent drop",
        "reference": "planned target bearing in F_project recorded before collection",
        "uncertainty": "5 deg placement reference plus 2 deg azimuth grid; acoustic-axis alignment unmeasured",
        "units": "deg"
      },
      "observable": "stratum_a_take_median_bearing_absolute_error_deg",
      "sample_kind": "series",
      "statistic": "median",
      "strata": [
        "A_controlled_boundary_sweep"
      ],
      "threshold": 15.0,
      "tier": "readiness"
    },
    {
      "comparator": "less_than_or_equal",
      "criterion_id": "bearing_p95_absolute_error_stratum_a",
      "decision_rationale": "Fit-A p95 was 15 deg; 30 deg is one full 8-sector width and is the largest tail error that still leaves a turn decision in the correct half-plane",
      "denominator": {
        "basis": "takes",
        "expected_count": 24
      },
      "failure_logic": "a violated readiness criterion keeps S4.8 and S4 failed for the claimed envelope and may not be relaxed, rescoped, or removed",
      "gating": true,
      "metric": "bearing_doa_error",
      "metric_contract": {
        "aggregation": "per-take median, then the named statistic across takes",
        "applicability": "bearing-referenced controlled takes inside the frozen envelope",
        "exclusions": "abstained windows are excluded from the numeric error and counted separately by the abstention criteria; no take is excluded",
        "limitations": "functional bearing accuracy of the exact tested rig, room, source, and analysis path; not a calibrated or transferable angular accuracy",
        "method": "SRP-PHAT primary estimator on frozen raw-channel analysis windows, reduced to one median absolute bearing error per take",
        "missing": "a take with no valid bearing window is a criterion failure, never a silent drop",
        "reference": "planned target bearing in F_project recorded before collection",
        "uncertainty": "5 deg placement reference plus 2 deg azimuth grid; acoustic-axis alignment unmeasured",
        "units": "deg"
      },
      "observable": "stratum_a_take_median_bearing_absolute_error_deg",
      "sample_kind": "series",
      "statistic": "p95_nearest_rank",
      "strata": [
        "A_controlled_boundary_sweep"
      ],
      "threshold": 30.0,
      "tier": "readiness"
    },
    {
      "comparator": "less_than_or_equal",
      "criterion_id": "bearing_worst_absolute_error_stratum_a",
      "decision_rationale": "bounds the single worst take away from the front-back confusion regime that the S4.5 corrective resolved; the S4.3 pilot worst of 82 deg would fail this bound",
      "denominator": {
        "basis": "takes",
        "expected_count": 24
      },
      "failure_logic": "a violated readiness criterion keeps S4.8 and S4 failed for the claimed envelope and may not be relaxed, rescoped, or removed",
      "gating": true,
      "metric": "bearing_doa_error",
      "metric_contract": {
        "aggregation": "per-take median, then the named statistic across takes",
        "applicability": "bearing-referenced controlled takes inside the frozen envelope",
        "exclusions": "abstained windows are excluded from the numeric error and counted separately by the abstention criteria; no take is excluded",
        "limitations": "functional bearing accuracy of the exact tested rig, room, source, and analysis path; not a calibrated or transferable angular accuracy",
        "method": "SRP-PHAT primary estimator on frozen raw-channel analysis windows, reduced to one median absolute bearing error per take",
        "missing": "a take with no valid bearing window is a criterion failure, never a silent drop",
        "reference": "planned target bearing in F_project recorded before collection",
        "uncertainty": "5 deg placement reference plus 2 deg azimuth grid; acoustic-axis alignment unmeasured",
        "units": "deg"
      },
      "observable": "stratum_a_take_median_bearing_absolute_error_deg",
      "sample_kind": "series",
      "statistic": "worst",
      "strata": [
        "A_controlled_boundary_sweep"
      ],
      "threshold": 60.0,
      "tier": "readiness"
    },
    {
      "comparator": "less_than_or_equal",
      "criterion_id": "bearing_median_absolute_error_stratum_b",
      "decision_rationale": "the same decision-relevant bound applied to the sector-center family so that bearing quality is not claimed only on the boundary sweep",
      "denominator": {
        "basis": "takes",
        "expected_count": 8
      },
      "failure_logic": "a violated readiness criterion keeps S4.8 and S4 failed for the claimed envelope and may not be relaxed, rescoped, or removed",
      "gating": true,
      "metric": "bearing_doa_error",
      "metric_contract": {
        "aggregation": "per-take median, then the named statistic across takes",
        "applicability": "bearing-referenced controlled takes inside the frozen envelope",
        "exclusions": "abstained windows are excluded from the numeric error and counted separately by the abstention criteria; no take is excluded",
        "limitations": "functional bearing accuracy of the exact tested rig, room, source, and analysis path; not a calibrated or transferable angular accuracy",
        "method": "SRP-PHAT primary estimator on frozen raw-channel analysis windows, reduced to one median absolute bearing error per take",
        "missing": "a take with no valid bearing window is a criterion failure, never a silent drop",
        "reference": "planned target bearing in F_project recorded before collection",
        "uncertainty": "5 deg placement reference plus 2 deg azimuth grid; acoustic-axis alignment unmeasured",
        "units": "deg"
      },
      "observable": "stratum_b_take_median_bearing_absolute_error_deg",
      "sample_kind": "series",
      "statistic": "median",
      "strata": [
        "B_center_nominal_level"
      ],
      "threshold": 15.0,
      "tier": "readiness"
    },
    {
      "comparator": "greater_than_or_equal",
      "criterion_id": "sector_accuracy_stratum_b",
      "decision_rationale": "six of eight sector-center takes must land in the correct sector; this exceeds the 0.667 S4.3 pilot gate and is the directly decision-relevant quantity for an 8-sector display",
      "denominator": {
        "basis": "takes",
        "expected_count": 8
      },
      "failure_logic": "a violated readiness criterion keeps S4.8 and S4 failed for the claimed envelope and may not be relaxed, rescoped, or removed",
      "gating": true,
      "metric": "sector_accuracy",
      "metric_contract": {
        "aggregation": "correct take count divided by the frozen take denominator",
        "applicability": "sector-center bearings only; boundary-family bearings are excluded because a sub-degree error flips the sector by construction",
        "exclusions": "none; abstained takes count as incorrect",
        "limitations": "an eight-sector functional display decision, not a continuous angular accuracy claim",
        "method": "per-take majority sector from bearing_deg_to_sector_name compared against the sector containing the planned bearing",
        "missing": "a take with no majority sector counts as incorrect",
        "reference": "planned target bearing in F_project mapped to the 8-sector display",
        "uncertainty": "sector assignment is exact given a bearing; the underlying bearing carries the frozen 5 deg placement and 2 deg grid uncertainty",
        "units": "fraction"
      },
      "observable": "stratum_b_sector_correct_take_count",
      "sample_kind": "counter",
      "statistic": "rate",
      "strata": [
        "B_center_nominal_level"
      ],
      "threshold": 0.75,
      "tier": "readiness"
    },
    {
      "comparator": "greater_than_or_equal",
      "criterion_id": "candidate_coverage_strata_ab",
      "decision_rationale": "the candidate set is the ambiguity-aware output consumed downstream; coverage must exceed the 0.667 S4.3 pilot gate without demanding the 0.974 controlled-pilot value on unseen data",
      "denominator": {